[
  {
    "id": "south-entry",
    "lane_id": "south_in_0",
    "role": "entry",
    "position_m": 6,
    "label": "South entry"
  },
  {
    "id": "north-entry",
    "lane_id": "north_in_0",
    "role": "entry",
    "position_m": 6,
    "label": "North entry"
  },
  {
    "id": "east-entry",
    "lane_id": "east_in_0",
    "role": "entry",
    "position_m": 6,
    "label": "East entry"
  },
  {
    "id": "west-entry",
    "lane_id": "west_in_0",
    "role": "entry",
    "position_m": 6,
    "label": "West entry"
  },
  {
    "id": "south-exit",
    "lane_id": "south_out_0",
    "role": "exit",
    "position_m": 186,
    "label": "South exit"
  },
  {
    "id": "north-exit",
    "lane_id": "north_out_0",
    "role": "exit",
    "position_m": 186,
    "label": "North exit"
  },
  {
    "id": "east-exit",
    "lane_id": "east_out_0",
    "role": "exit",
    "position_m": 186,
    "label": "East exit"
  },
  {
    "id": "west-exit",
    "lane_id": "west_out_0",
    "role": "exit",
    "position_m": 186,
    "label": "West exit"
  }
]
